{
  "version": "1.0.0",
  "checkpoint_id": "HISTORICAL-SAGA-20261024-2015-JAKE-ARC",
  "project": "schemin-26",
  "workflow": "historical-saga-2015-2026",
  "stage": "BOUNDED_2015_JAKE_EVENTS_EXHAUSTED_DRAFT_REVIEWED",
  "owner": "Novel production task",
  "source_authority": "living-novel/whole-book/WHOLE_BOOK_SOURCE_AUTHORITY_MATRIX_V1.md",
  "completed_at": "2026-10-24T05:52:23.342842+00:00",
  "input_fingerprints": [
    {
      "path": "living-novel/production/historical-saga/approved-mission-2015-2026/evidence/2015_FIXTURE_COVERAGE.json",
      "digest_algo": "sha256",
      "digest": "73fb75de749b25ee055a1ebe07c1617fc9dcd921b171b26bb3899efac47feaff"
    },
    {
      "path": "living-novel/production/historical-saga/approved-mission-2015-2026/evidence/owner-extraction-audit/FLAIM_CONNECTED_ACCOUNT_CONTINUITY.md",
      "digest_algo": "sha256",
      "digest": "f7746a9765b83dddc5d42d17788799d95971853b9b0bda2624085dafcf3bb219"
    },
    {
      "path": "canon/characters/CHARACTER_REGISTRY.yaml",
      "digest_algo": "sha256",
      "digest": "972947f50831b31e0a7e89538da38a907f4dbf8578d2a16e4cc210baeeacfd48"
    }
  ],
  "outputs": [
    {
      "path": "living-novel/production/historical-saga/approved-mission-2015-2026/manuscript/2015-jake-arc/THE_COST_OF_RETURN_NONCANON.md",
      "digest_algo": "sha256",
      "digest": "dc4d79a2865bb1a330a6814dba97419811d3015bd8a85a6067a0f6cc3edee183"
    },
    {
      "path": "living-novel/production/historical-saga/approved-mission-2015-2026/manuscript/2015-jake-arc/THE_RECORD_HE_CANNOT_KEEP_NONCANON.md",
      "digest_algo": "sha256",
      "digest": "0a99459353a561a7d587f23f9af9b27a054d450f9c965120612c22a49c0ed984"
    },
    {
      "path": "living-novel/production/historical-saga/approved-mission-2015-2026/manuscript/2015-jake-arc/SCENE_REGISTER.json",
      "digest_algo": "sha256",
      "digest": "ca200704fea58338407598bd06b17d04fd6b02dc673f920bf242c0865d8b0fc1"
    }
  ],
  "evidence": [
    "living-novel/consultants/author-council/engagements/HISTORICAL-SAGA-2015-2026-2026-10-24/historical-supplement/2015_JAKE_ARC_RECONCILIATION.md",
    "living-novel/production/historical-saga/approved-mission-2015-2026/review/2015_JAKE_ARC_CHECK.json"
  ],
  "invalidation_triggers": [
    "Changes to user-attested identity, Flaim continuity, 2015 team-1 events, scene register or prose require re-review."
  ]
}
