{
  "version": "1.0.0",
  "checkpoint_id": "NOVEL-CH1-V3-2026-10-28-EDITORIAL-REVISION-CI",
  "project": "Schemin '26",
  "workflow": "Commonwealth Novel Production / Chapter I noncanonical rewrite",
  "stage": "noncanonical manuscript V3 assembly + deterministic CI (NOT independent editorial acceptance)",
  "owner": "Novel OS tool-enabled production, independent Umpire pending",
  "source_authority": "living-novel/whole-book/WHOLE_BOOK_SOURCE_AUTHORITY_MATRIX_V1.md",
  "completed_at": "2026-10-28T18:39:11.667Z",
  "input_fingerprints": [
    {
      "path": "living-novel/whole-book/WHOLE_BOOK_SOURCE_AUTHORITY_MATRIX_V1.md",
      "digest_algo": "git_blob",
      "digest": "67fcd669dc7b43393f2d15e93545301961dd81e4"
    },
    {
      "path": "living-novel/manuscript/CHAPTER_01_THE_FIRST_ANSWER.md",
      "digest_algo": "git_blob",
      "digest": "26a17f05eb0565e7648c29add03ee9580ec933c3"
    },
    {
      "path": "living-novel/os/adapters/flaim/PRO_SCHEMIN_SOURCE_FUSION_AUDIT_W1_W2_V1.md",
      "digest_algo": "git_blob",
      "digest": "fa77a2906e174a7edfa5dfb7f616dd9199205e25"
    },
    {
      "path": "canon/characters/CHARACTER_REGISTRY.yaml",
      "digest_algo": "git_blob",
      "digest": "30b490eece6bfcb7edafcb7d2a59c391d1a621d7"
    },
    {
      "path": "living-novel/production/full-rewrite-2026/2026-10-28-causal-cut/CHAPTER_I_THE_FIRST_ANSWER_CAUSAL_READING_CANDIDATE_V2.md",
      "digest_algo": "git_blob",
      "digest": "e3552be0154b9a719d873256bdb137f03441ffb8"
    }
  ],
  "outputs": [
    {
      "path": "living-novel/production/full-rewrite-2026/2026-10-28-causal-cut/CHAPTER_I_THE_FIRST_ANSWER_CAUSAL_READING_CANDIDATE_V3.md",
      "digest_algo": "git_blob",
      "digest": "89c5f1563d7cfb939e855a79dfe15eb2affe62f6"
    },
    {
      "path": "living-novel/production/full-rewrite-2026/2026-10-28-causal-cut/CHAPTER_I_CAUSAL_CUT_PART_II_REVISED_V3_NONCANON.md",
      "digest_algo": "git_blob",
      "digest": "03f8506bd6421a81d01d8b38051b1d51ec115f83"
    },
    {
      "path": "living-novel/os/evaluations/test_chapter_i_causal_cut_v3.py",
      "digest_algo": "git_blob",
      "digest": "c8158a0c199b34e015605f0a38e41facf067af0d"
    },
    {
      "path": "living-novel/production/full-rewrite-2026/2026-10-28-causal-cut/V3_EDITORIAL_CHALLENGE_AND_VERIFICATION_RECEIPT_2026_10_28.md",
      "digest_algo": "git_blob",
      "digest": "4661708545fc89d2af98b5cf94fbdc8cdc10f699"
    }
  ],
  "evidence": [
    "https://github.com/jakekaloper-hub/schemin-26/pull/264",
    "https://github.com/jakekaloper-hub/schemin-26/actions/runs/40746793901",
    "https://github.com/jakekaloper-hub/schemin-26/actions/runs/40746793901/job/123022598172",
    "living-novel/production/full-rewrite-2026/2026-10-28-causal-cut/V3_EDITORIAL_CHALLENGE_AND_VERIFICATION_RECEIPT_2026_10_28.md"
  ],
  "invalidation_triggers": [
    "protected Chapter I or source matrix blob changes",
    "canonical twelve-owner registry or Ben/Jake/Austin active dossier changes",
    "verified Week 1 source truth changes or source audit is superseded",
    "candidate manuscript or assembled standalone scene is edited",
    "CI test changes, fails, or independent Umpire rejects the literary proposal",
    "Founder explicitly reopens the draft or authorizes a different manuscript direction"
  ]
}
